{
  "schemaVersion": 1,
  "version": "community-custom-v1",
  "mode": "extend",
  "preset": "community-v1",
  "filters": [
    {
      "id": "spam",
      "review": 0.6,
      "block": 0.95
    },
    {
      "id": "competitor_promotion",
      "definition": "A promotional message urging users to switch to RivalApp. Neutral comparisons and support questions mentioning RivalApp are allowed.",
      "review": 0.5,
      "block": 0.9
    }
  ]
}
